id,title,author,category_id,description,img_url,isbn
1,The Green Belt,Thế Vinh Ngô,1,"""The Green Belt"" is the story of a Vietnamese newspaper reporter who journeyed into the central highlands of Vietnam during the war in the late 1960s and witnessed the traditional antagonism between tribal highlanders and lowland Vietnamese. Of interest and current significance is the narrator's account of the highlanders' side of the conflict, and his evaluation of alternative solutions that could have advanced the welfare of ethnic minorities. Socially relevant, the novel recounts a true ongoing conflict. Fighting over land and religion in Vietnam's central highlands is a human rights issue frequently making the news. Several thousand Montagnards, many of whom fought alongside the U.S. Special Forces during the Vietnam War, resettled in North Carolina in the period after 1975. This large community never stops growing as a result of the endless exodus for freedom. The compelling story of this novel, blended of fact and fiction, reveals the roots of unrest and is a unique voice advocating survival of indigenous peoples in mainland Southeast Asia.",https://books.google.com/books/content?id=2CNFI_8ZZbAC&printsec=frontcover&img=1&zoom=1&source=gbs_api,157197394X
2,Người La Ha ở Việt Nam,"Thị Thu Hương Lê, Thúy Hằng Bùi",1,"Cuốn sách tập hợp những hình ảnh chân thực và sinh động phản ánh nhiều phương diện trong đời sống của người La Ha từ nguồn gốc và phân bố dân cư, bản làng, nhà ở, nguồn sống...",https://books.google.com/books/content?id=VNKMaSBk4f8C&printsec=frontcover&img=1&zoom=1&source=gbs_api,UOM:39015105346756
3,NTC's Vietnamese-English Dictionary,Dinh-hoa Nguyen,1,"Includes 50,000 definitions and pronunciation tones for northern, central, and southern parts of Vietnam.",https://books.google.com/books/content?id=4892EoUm2REC&printsec=frontcover&img=1&zoom=1&source=gbs_api,0844283576
4,Blank Verse,Khế Iêm,1,"Vietnamese New Formalism poetry is a type of modern folk poetry, not the kind of poetry that has become literature and selected for lectures in the schools under intellectual scrutiny, but the kind of poetry that permeates the common folk, reflecting their ordinary daily activities. --Dang Tien.",https://books.google.com/books/content?id=EYlkAAAAMAAJ&printsec=frontcover&img=1&zoom=1&source=gbs_api,UOM:39015064303822
5,Tiểu luận & phê bình văn học,Quốc Liên Mai,1,Literary essays and criticism.,https://books.google.com/books/content?id=APoQHmHgrmAC&printsec=frontcover&img=1&zoom=1&source=gbs_api,UCBK:C112425578
6,VAN CHUONG TAN RÃ,Inrasara Nhà van,1,"VĂN CHƯƠNG TAN RÃ Tác giả Inrasara Lotus Media xuất bản, Hoa Kỳ, 2019 Bìa và trình bày: Uyên Nguyên",https://books.google.com/books/content?id=zURkwwEACAAJ&printsec=frontcover&img=1&zoom=1&source=gbs_api,0359516319
7,CUỘC CHIẾN VÀNG - ĐÔ QUA LĂNG KÍNH KINH TẾ CHÍNH TRỊ,TRẦN HÀN,2,"Không phải mọi cuộc chiến đều có tiếng súng. Có những cuộc chiến diễn ra trong bóng tối của ngân hàng trung ương, trong những căn phòng kín của giới quyền lực, nơi một quyết định nhỏ có thể làm sụp đổ cả nền kinh tế. Ở đó, vàng và đô la Mỹ lặng lẽ đối đầu. Một bên là kim loại cổ xưa đã tồn tại hàng nghìn năm, không thể in thêm, không thể thao túng. Một bên là đồng tiền quyền lực nhất lịch sử, được hậu thuẫn bởi sức mạnh chính trị và những cỗ máy in tiền không ngừng nghỉ. Khi khủng hoảng bùng nổ, chiến tranh nổ ra, niềm tin lung lay… dòng vốn bí ẩn luôn dịch chuyển. Ai đang điều khiển nó? Ai thực sự kiểm soát luật chơi? Cuộc chiến Vàng – USD qua lăng kính kinh tế chính trị không chỉ kể câu chuyện về tiền tệ, mà bóc tách những tầng sâu của quyền lực toàn cầu – nơi kinh tế là vũ khí, còn tiền tệ là công cụ thống trị. Sự thật đôi khi không nằm trên bảng giá. Nó nằm sau cánh cửa mà rất ít người được phép nhìn thấy.",https://books.google.com/books/content?id=Kde7EQAAQBAJ&printsec=frontcover&img=1&zoom=1&edge=curl&source=gbs_api,N/A
8,Một số vấn đề lý luận kinh tế chính trị và phát triển kinh tế Việt Nam,Unknown,2,Collection of arguments on socio-economic and political development in Vietnam.,https://books.google.com/books/content?id=5LbsAAAAMAAJ&printsec=frontcover&img=1&zoom=1&source=gbs_api,UOM:39015038228899
9,"Cơ sở khoa học đẻ̂ xây dựng tiêu chí, bước đi, cơ ché̂ chính sách trong quá trình công nghiệp hoá, hiện đại hoá nông nghiệp, nông thôn",Unknown,2,Aspects of industrialization and modern agriculture for economic development in the rural area of Vietnam.,https://books.google.com/books/content?id=y7TsAAAAMAAJ&printsec=frontcover&img=1&zoom=1&source=gbs_api,UOM:39015063135860
10,Góp phần tìm hiểu quyền con người ở Việt Nam,Hùng Hải Hoàng,2,On the implementation of human rights in Vietnam.,https://books.google.com/books/content?id=mAxjiGfwSFEC&printsec=frontcover&img=1&zoom=1&source=gbs_api,UCBK:C100348946
11,Su Quan Ly Cong Cong Cua Viet Nam Trong Chuyen Tiep,Hai B. Pho,2,"""Preface to the English-Vietnamese bilingual edition""--P. 245.",https://books.google.com/books/content?id=6o0MAAAAYAAJ&printsec=frontcover&img=1&zoom=1&source=gbs_api,UVA:X004612187
12,"Về phát triển văn hóa và xây dựng con người thời kỳ công nghiệp hóa, hiện đại hóa",Unknown,2,"Trình bày những nội dung cơ bản về tư tưởng Hồ Chí Minh đối với phát triển văn hoá và xây dựng con người; mối quan hệ giữa văn hoá và phát triển trong thời kỳ đổi mới, phát triển toàn diện con người và xây dựng lối sống, đạo đức và chuẩn giá trị mới, một số vấn đề dân tộc và tôn giáo, ...một số khuyến nghị và giải pháp cho các vấn đề trên.",https://books.google.com/books/content?id=GdZwAAAAMAAJ&printsec=frontcover&img=1&zoom=1&source=gbs_api,UOM:39015052966911
13,"Dong Dang-Lang Son border gate economic zone, Lang Son Province",Unknown,2,"On the activities of the Dong Dang-Lang Son economic zone and the socioeconomic development in Lang Son Province, Vietnam.",https://books.google.com/books/content?id=vpb00jqnOvIC&printsec=frontcover&img=1&zoom=1&source=gbs_api,WISC:89117688515
14,Một số văn kiện của đảng và nhà nước về Thành phố Hồ Chí Minh,Unknown,2,Government decisions and ministerial circulars on Ho Chi Minh City development.,https://books.google.com/books/content?id=flBRAQAAMAAJ&printsec=frontcover&img=1&zoom=1&source=gbs_api,UCBK:C095135938
15,Cuộc hải chiến huyền thoại trên đảo Gạc Ma,Unknown,2,International law in Paracel Island and Spratly Island and history of sea battle in Vietnam.,https://books.google.com/books/content?id=h26jH6TTcywC&printsec=frontcover&img=1&zoom=1&source=gbs_api,CORNELL:31924120894583
16,Biẻ̂n đông yêu dấu,Ngọc Toản Trần,2,Territorial waters of Vietnam in the South China Sea called East Vietnam Sea includes Spratly Islands (Trường Sa) and Paracel Islands (Hoàng Sa).,https://books.google.com/books/content?id=bWyEMP-LQ7MC&printsec=frontcover&img=1&zoom=1&source=gbs_api,CORNELL:31924117680144
17,Xây dựng đời sống văn hóa,Unknown,2,Social life in Vietnam,https://books.google.com/books/content?id=T1iSCpPvd7EC&printsec=frontcover&img=1&zoom=1&source=gbs_api,CORNELL:31924105074995
18,Thực thi luật và chính sách bảo vệ môi trường tại Việt Nam,"Đức Khiển Nguyễn, Văn Đức Phạm, Minh Trí Đinh",2,"Giới thiệu chính sách, luật pháp các văn bản hướng dẫn thi hành luật bảo vệ môi trường Việt Nam, phân tích hiện trạng môi trường Việt Nam, ảnh hưởng của môi trường tới sức khỏe cộng đồng, phân tích diễn biến quá trình đô thị hóa ở Việt Nam, thách thức xây dựng chiến lược phát triển thành phố, trình bày sự biến đổi khí hậu thế giới nói chung và Việt Nam nói riêng.",https://books.google.com/books/content?id=DgJ8I4-0NLEC&printsec=frontcover&img=1&zoom=1&source=gbs_api,CORNELL:31924114747276
19,Cách mạng tháng mười Nga và một số vấn đề cấp bách về thời đại ngày nay,Unknown,2,"History of the October revolution, 1917 in Russia.",https://books.google.com/books/content?id=TYXzFjOAvBAC&printsec=frontcover&img=1&zoom=1&source=gbs_api,UOM:39015073832118
20,Suy tưởng,Trần Bạt Nguyễn,2,Essays on sociopolitical development in Vietnam and worldwide.,https://books.google.com/books/content?id=K6JTXnSEwNsC&printsec=frontcover&img=1&zoom=1&source=gbs_api,CORNELL:31924102687096
21,Chức năng quản lý kinh tế của Nhà nước: từ lý luận đến thực tiễn ở Việt Nam,"Nguyễn Hồng Sơn, Nguyễn Hồng Thái",2,"Nhà nước và kinh tế là hai phạm trù cơ bản xác lập mối quan hệ giữa kiến trúc thượng tầng chính trị và hạ tầng kinh tế của mọi quốc gia. Vì vậy, mối quan hệ giữa kinh tế và nhà nước luôn là một trong những mối quan hệ cơ bản có ý nghĩa quyết định đến sự thịnh, suy của một đất nước trong quá trình phát triển. Sự tương tác giữa kinh tế và nhà nước diễn ra khá phức tạp và được thể hiện cả hai chiều: kinh tế quy định tổ chức và hoạt động của bộ máy nhà nước theo nguyên lý hạ tầng kinh tế quyết định thượng tầng kiến trúc chính trị và chiều thứ hai là nhà nước tác động mạnh mẽ đến các quá trình kinh tế. Sự tác động trở lại của nhà nước đối với kinh tế có thể đưa lại những kết quả tích cực, thúc đẩy sự phát triển mạnh mẽ của đời sống kinh tế khi nhà nước tác động đúng đắn đến kinh tế, tôn trọng các quy luật khách quan của kinh tế, thực hiện tốt vai trò là “bà đỡ” của kinh tế. Ngược lại, một khi nhà nước tác động vào kinh tế một cách chủ quan, duy ý chí, áp đặt theo kiểu mệnh lệnh hành chính sẽ trở thành yếu tố kìm hãm sự phát triển lành mạnh của các quan hệ kinh tế, tạo ra nguy cơ khủng hoảng kinh tế - xã hội. Vì lẽ đó, nghiên cứu mối quan hệ giữa kinh tế và nhà nước luôn thu hút sự quan tâm của nhiều ngành khoa học xã hội: kinh tế học, chính trị học, xã hội học và luật học,…",https://books.google.com/books/content?id=ejsNEQAAQBAJ&printsec=frontcover&img=1&zoom=1&edge=curl&source=gbs_api,9786047628957
22,Liên ké̂t kinh té̂ giữa sản xuá̂t và thương mại trong quá trình chuyẻ̂n sang nè̂n kinh té̂ thị trường,Bá Phượng Dương,2,Effect of free trade to socio-economic in Vietnam.,https://books.google.com/books/content?id=ZeIaJBdKjkcC&printsec=frontcover&img=1&zoom=1&source=gbs_api,UCBK:C095886711
23,Kinh tế Việt Nam - Thăng trầm và đột phá: Góc nhìn xuyên suốt một hành trình đổi mới,TUỆ LÂM,2,"Mỗi chặng đường phát triển của đất nước đều để lại dấu ấn kinh tế rất riêng - khi là thành tựu, lúc lại là những bài học sâu sắc. Cuốn sách “Kinh tế Việt Nam - Thăng trầm và đột phá” là một nỗ lực ghi lại hành trình ấy bằng thái độ khoa học nghiêm túc, cái nhìn đa chiều và tinh thần trách nhiệm cao độ.",https://books.google.com/books/content?id=isakEQAAQBAJ&printsec=frontcover&img=1&zoom=1&edge=curl&source=gbs_api,N/A
24,20 năm đổi mới và sự hình thành thể chế kinh tế thị trường định hướng xã hội chủ nghĩa,Cúc Nguyễn,2,Giới thiệu quá trình đổi mới và sự lựa chọn kinh tế thị trường định hướng XHCN ở nước ta. Đổi mới thể chế kinh tế phù hợp với cơ chế thị trường định hướng XHCN. Đổi mới hệ thống chính trị phù hợp với điều kiện kinh tế thị trường định hướng XHCN ở nước ta. Lý luận về sở hữu và tái cơ cấu doanh nghiệp. Hội nhập và nâng cao sức cạnh tranh của nền kinh tế.,https://books.google.com/books/content?id=wp5PAQAAMAAJ&printsec=frontcover&img=1&zoom=1&source=gbs_api,UCR:31210020951560
25,Kinh T¿ H¿c So пng Qua M¿t Bài H¿c,Unknown,2,"Kinh Tế Học là một môn học được coi là khô khan nhưng dễ học, và đây cũng là một lý do tại sao các học sinh đã đậu tú tài toàn phần ở Việt Nam sau 1975 đã đua nhau thi vào trường Đại học Kinh tế. Nhưng có một sự thật mà ít người biết đến, đó là môn học này tuy dễ học nhưng khó có ai mà có thể thu thập được tất cả các luật lệ chủ yếu ban đầu của nó mà khi áp dụng vào thực tế đều bỏ sót các khía cạnh quan trọng và kết quả là đưa tới những ngộ nhận chung quanh một vấn đề áp dụng của một luật nào đó. Nhưng từ khi cuốn sách Kinh Tế Học này được viết bởi Henry Hazlitt, một chủ bút văn học chuyên viết về các đề tài và các bài báo phê bình với chủ đề Kinh tế học đã ra đời, nó đã hướng dẫn và giáo dục lại không những các sinh viên mà còn cả những nhà kinh tế học lão luyện đã từng áp dụng các luật cơ bản một cách thiếu sót và đã bỏ qua các kết quả quan trọng của một chính sách kinh tế nào đó. Dịch giả Vân Trường, chỉ với một văn bằng Cử nhân văn chương Anh ngữ, nhưng với một trình độ hiểu biết văn phạm và ngữ vựng phong phú đã chuyển ngữ một cách tường tận và lưu loát tất cả những ý chính trong quyển Kinh Tế Học Sơ Đẳng Qua Một Bài Học này để giúp đỡ cho các sinh viên hoặc những ai muốn chiếm hữu một kiến thức hoàn hảo về các luật lệ cơ bản của môn kinh tế học nhằm mục đích để phát triển trình độ hiểu biết thì nên mua ngay cuốn sách này để học hỏi.",https://books.google.com/books/content?id=U9bKzgEACAAJ&printsec=frontcover&img=1&zoom=1&source=gbs_api,1990434258
26,Những đỉnh cao chỉ huy,"Daniel Yergin, Joseph Stanislaw, Phạm Quang Diệu",2,"Cuốn sách thuật lại cuộc chiến giữa hai định hướng: thị trường tự do và nhà nước quản lý, ở các nước như Anh, Ấn Độ, Trung Quốc... hai định hướng này đã đấu tranh và giằng co như thế nào. Tuy sách này không có được sự hoành tráng như cuốn Dầu mỏ, nhưng đọc cũng rất đã, nếu bạn đã từng một lần đặt ra câu hỏi trong đầu rằng cách nào tốt hơn cho nền kinh tế hiện tại: tự do hóa thị trường hay có sự định hướng của nhà nước? Nếu có sự can thiệp của nhà nước thì nên can thiệp ở mức độ nào?... Tất nhiên, các câu hỏi trên không thể được giải đáp triệt để bởi cuốn sách, nhưng được hai tác giả kể lại những câu chuyện thực tế xảy ra ở các nước liên quan đến vấn đề trên cũng giúp mỗi độc giả có thể tự rút ra kết luận tạm thời của riêng mình.",https://books.google.com/books/content?id=zL6qEAAAQBAJ&printsec=frontcover&img=1&zoom=1&edge=curl&source=gbs_api,N/A
27,Tác động của hội nhập kinh tế quốc tế đến tư duy và đời sống kinh tế-xã hội ở Việt Nam,Unknown,2,Influence of world trade integration to the social life in Vietnam.,https://books.google.com/books/content?id=9mOOm5gJ26QC&printsec=frontcover&img=1&zoom=1&source=gbs_api,UCBK:C069972736
28,Mô hình tăng trưởng kinh tế của Việt Nam,"Văn Hiền Hà, Hồng Chương Phạm",2,Economic growth model of Vietnam in post-crisis of world economy.,https://books.google.com/books/content?id=mydonh6b4aMC&printsec=frontcover&img=1&zoom=1&source=gbs_api,CORNELL:31924119642704
29,Nền kinh tế thị trường & chính sách hai đò̂ng nội tệ,Đức Lương Đỗ,2,On the economic policy and the market conditions in Vietnam.,https://books.google.com/books/content?id=Nm3c8jD9dMAC&printsec=frontcover&img=1&zoom=1&source=gbs_api,CORNELL:31924111065151
30,Nền kinh tế quá độ trong thời kỳ quá độ lên chủ nghĩa xã hội ở Việt Nam,Văn Phúc Vũ,2,Economic development during the transitional period in Vietnam.,https://books.google.com/books/content?id=gNwGop4-TD0C&printsec=frontcover&img=1&zoom=1&source=gbs_api,UCR:31210020325062
31,Kinh tế Mỹ,Thiết Sơn Nguyễn,2,"Sự thăng trà̂m kinh té̂ Mỹ và việc duy trì vai trò cường quó̂c, kinh té̂ só̂ một Mỹ - NAFTA và tác động của nó đó̂i với nè̂n kinh té̂ thé̂ giới. Đà̂u tư nước ngoài của Mỹ. Mỹ kích thích xuá̂t khuả̂u như thé̂ nào? Kinh té̂ Mỹ đà̂u những năm 90 và triẻ̂n vọng.",https://books.google.com/books/content?id=CXTsAAAAMAAJ&printsec=frontcover&img=1&zoom=1&source=gbs_api,UOM:39015037609883
32,Kinh tế Việt Nam trên đường hội nhập,Ngọc Thơ Trần,2,Aspects of economic liberalisation to the economic growths in Vietnam.,https://books.google.com/books/content?id=xcnsAAAAMAAJ&printsec=frontcover&img=1&zoom=1&source=gbs_api,UOM:39015063121787
33,Nền Tảng Tâm Lý Học, Nicky Hayes,3,"Những ai đang quan tâm đến ngành tâm lý học, chắc chắn phải luôn đặt ra những câu hỏi là tâm lý học hiện đại đến từ đâu và phát triển từ nền tảng cốt lõi nào? "" Nền tảng tâm lý học "" trình bày súc tích và đầy đủ nhất về nguồn gốc triết học của tâm lý học, các trường phái tư tưởng trong tâm lý học, các lĩnh vực cùng những quan điểm tâm lý học khác nhau...Phương pháp biên soạn của sách còn nhắm đến ba mục đích chính: giải thích những quan điểm hoàn toàn phức tạp, sử dụng ngôn ngữ rõ ràng, dễ hiểu; chứng minh quan điểm về tâm lý học đã phát triển rõ nét và phong phú khoảng hơn một thế kỷ qua và cuối cùng là phản ánh những gì đang diễn ra trong tâm lý học hiện đại. Sách còn cung cấp một cách nhìn rộng thoáng, chiết trung, luôn cập nhật về ngành tâm lý học. Mục lục: Lời nói đầu Chương 1: Quan điểm trong tâm lý học Phần 1: Tâm lý học nhận thức Chương 2: Nhận thức và chú ý Chương 3: Trí nhớ Chương 4: Ngôn ngữ và biết đọc biết viết Chương 5: Suy nghĩ và trình bày Phần 2: Tính chất cá nhân và tính bất thường Chương 6: Trí năng Chương 7: Thuyết nhân cách Chương 8: Mô hình y tế của hành vi bất thường Chương 9: Những mô hình thay thế mô hình y tế Phần 3: Tâm lý học sinh lý Chương 10: Phát triển não và tâm lý học thần kinh lâm sàng Chương 11: Ý thức Chương 12: Cảm giác và cận tâm lý học Chương 13: Cảm xúc và động cơ thúc đẩy Phần 4: Tâm lý học xã hội Chương 14: Cái tôi và người khác Chương 15: Tìm hiểu người khác Chương 16: Ảnh hưởng xã hội và hoạt động xã hội Chương 17: Thái độ, thành kiến và hành vi đám đông Phần 5: Tâm lý học phát triển Chương 18: Tập quen và phát triển kỹ năng Chương 19: Phát triển nhận thức và nhận thức xã hội Chương 20: Phát triển xã hội Chương 21: Tâm lý học phát triển tuổi đời Phần 6: Tâm lý học so sánh Chương 22: Giới thiệu tâm lý học so sánh Chương 23: Hành vi động vật Chương 24: Giao tiếp ở động vật Chương 25: Phương pháp và đạo đức trong tâm lý học Mời bạn đón đọc.",https://books.google.com/books/content?id=A3LQEAAAQBAJ&printsec=frontcover&img=1&zoom=1&edge=curl&source=gbs_api,N/A
34,Kiến tạo Harvard hiện đại,"Morton Keller, Phyllis Keller ",3,"Cuốn sách là bức tranh trung thực và giàu thông tin về trường đại học nổi bật nhất của Hoa Kỳ từ năm 1933 đến nay: bảy thập kỷ thay đổi kỳ diệu. Harvard của những năm đầu thế kỷ 20 là ngôi trường cổ kính và giàu có nhất đất nước, nhưng không có nghĩa là xuất sắc nhất. Đến cuối thế kỷ, trường đã được công nhận rộng rãi là cơ sở giáo dục đại học hàng đầu của quốc gia và quốc tế. Với sự nhiệt tình, hài hước và thấu hiểu, Morton và Phyllis Keller đã kể lại câu chuyện về sự chuyển mình vươn lên đó: một truyền thuyết về những con người hấp dẫn, những thành tựu đáng chú ý và cả những sai lầm về học thuật cũng đáng chú ý không kém. Với lần xuất bản này, các tác giả đã bổ sung thêm một chương về những bất đồng ý kiến xung quanh nhiệm kỳ viện trưởng và sự ra đi của Lawrence Summers. Họ cũng nêu lên khía cạnh lịch sử của những mối quan tâm lớn hiện nay ở Harvard: tác động của cuộc cách mạng khoa học đời sống, những thay đổi về chương trình giảng dạy ở trường Đại học và các truòng chuyên ngành, và việc xây dựng một cơ sở mới ở Allston.",https://books.google.com/books/content?id=CjA_EQAAQBAJ&printsec=frontcover&img=1&zoom=1&edge=curl&source=gbs_api,N/A
35,Mặc Kệ Thiên Hạ - Sống Như Người Nhật,Mari Tamagawa,3,"Nếu bạn định than thở ""Mình mệt quá"" hay ""Mình cảm thấy bị tổn thương"" rồi chờ mong ai đó xoa dịu thì đừng nên làm như vậy. Tại sao ư? Bởi điều đó không những không thể giúp bạn giải quyết nỗi khổ của bản thân mà còn cứa sâu vào vết thương của bạn. --Quan điểm của người khác sẽ chỉ mang tới cho bạn sự băn khoăn, phiền muộn và ngày càng dồn ép bạn .. --Quan điểm của bản thân sẽ giúp bạn tự tin, thoải mái hơn và cỗ vũ bạn bước tiếp..",https://books.google.com/books/content?id=7T3CDwAAQBAJ&printsec=frontcover&img=1&zoom=1&edge=curl&source=gbs_api,N/A
36,Cánh Cửa Tương Lai,BÙI QUYẾT,3,"Để thành công chúng ta cần có sự sáng tạo vậy làm thế nào để sáng tạo? Để sáng tạo chúng ta cần phải có những kiến thức, để có những kiến thức chúng ta cần phải tìm tòi và học hỏi. Cuốn sách ""Cánh Cửa Tương Lai"" là hành trang cần có giúp bạn bước chân trên con đường sáng tạo. chúc các bạn sớm thành công! Sách đã được đăng ký quyền tác giả tại Cục bản quyền tác giả Việt Nam.",https://books.google.com/books/content?id=O9sxEAAAQBAJ&printsec=frontcover&img=1&zoom=1&edge=curl&source=gbs_api,N/A
37,sự cần thiết 18000 từ điển y tế bằng tiếng Việt,Nam H Nguyen,3,sự cần thiết 18000 từ điển y tế ở bằng tiếng Việt là một nguồn lực lớn bất cứ nơi nào bạn đi; nó là một công cụ dễ dàng mà chỉ có những từ bạn muốn và nhu cầu! Toàn bộ từ điển là một danh sách chữ cái của từ y tế với các định nghĩa. Sách điện tử này là dễ hiểu dẫn đến thuật ngữ y tế cho bất cứ ai dù sao bất cứ lúc nào. Nội dung của sách điện tử này chỉ được sử dụng cho mục đích thông tin. Nó luôn luôn là một ý tưởng tốt để tham khảo ý kiến một bác sĩ chuyên nghiệp với vấn đề sức khỏe.,https://books.google.com/books/content?id=aW1ODwAAQBAJ&printsec=frontcover&img=1&zoom=1&edge=curl&source=gbs_api,N/A
