id,title,author,category_id,description,img_url,isbn
198,Nghệ thuật trí tuệ cảm xúc | Làm chủ cảm xúc để thay đổi cuộc sống của bạn,Adriano Leonel ,8,"Nghệ thuật trí tuệ cảm xúc | Làm chủ cảm xúc để thay đổi cuộc sống của bạn Khám phá bí quyết thay đổi cuộc sống của bạn bằng trí tuệ cảm xúc! Bạn đã bao giờ cảm thấy cảm xúc của mình mất kiểm soát chưa? Bạn có muốn cải thiện các mối quan hệ cá nhân và nghề nghiệp của mình? Bạn có muốn đạt được mức độ hạnh phúc tinh thần và cảm xúc cao hơn không? Sau đó, cuốn sách này là dành cho bạn. ""Nghệ thuật trí tuệ cảm xúc | Làm chủ cảm xúc để thay đổi cuộc sống của bạn"" là một hướng dẫn đầy đủ và thiết thực, tiết lộ cách phát triển và áp dụng trí tuệ cảm xúc trong mọi khía cạnh của cuộc sống. Với các chương toàn diện và chuyên sâu, cuốn sách này vượt xa các khái niệm cơ bản, đưa ra các chiến lược, kỹ thuật và những câu chuyện truyền cảm hứng để giúp bạn làm chủ cảm xúc, tăng cường sự đồng cảm và củng cố các kỹ năng xã hội của mình. Những gì bạn sẽ tìm thấy trong cuốn sách này: Tự nhận thức: Các công cụ và bài tập để hiểu rõ hơn về cảm xúc và hành vi của chính bạn. Tự kiểm soát: Các kỹ thuật đã được chứng minh giúp điều chỉnh phản ứng cảm xúc của bạn và vượt qua thử thách bằng khả năng phục hồi. Động lực: Các chiến lược tìm kiếm và thúc đẩy niềm đam mê và mục đích của bạn, thúc đẩy thành công cá nhân và nghề nghiệp của bạn. Đồng cảm: Các phương pháp phát triển sự hiểu biết sâu sắc và kết nối với người khác, cải thiện mối quan hệ giữa các cá nhân của bạn. Kỹ năng xã hội: Lời khuyên để cải thiện khả năng giao tiếp của bạn, giải quyết xung đột và xây dựng các mối quan hệ lành mạnh, lâu dài. Ứng dụng tại nơi làm việc: Trí tuệ cảm xúc có thể biến đổi môi trường làm việc như thế nào, tăng năng suất và tạo ra những nhà lãnh đạo hiệu quả. Sức khỏe Tâm thần: Mối liên hệ quan trọng giữa EI và sức khỏe tinh thần, với các công cụ thiết thực để chống lo âu và trầm cảm. Gia đình và các mối quan hệ: Cách củng cố mối quan hệ gia đình và nuôi dạy những đứa trẻ thông minh về mặt cảm xúc. Tầm nhìn cho tương lai: Các xu hướng và đổi mới về trí tuệ cảm xúc đang định hình tương lai của xã hội chúng ta. Với cách tiếp cận thực tế và dễ tiếp cận, cuốn sách này là cuốn sách cần thiết cho bất kỳ ai muốn thay đổi đời sống tình cảm của mình và đạt được mức độ hạnh phúc và thỏa mãn cao hơn. ""Nghệ thuật trí tuệ cảm xúc | Làm chủ cảm xúc để thay đổi cuộc sống của bạn"" là chìa khóa để giải phóng tiềm năng thực sự của bạn và sống một cuộc sống cân bằng, trọn vẹn. Hãy sẵn sàng cho một hành trình đầy biến đổi sẽ thay đổi cách bạn nhìn và tương tác với thế giới. Hãy tải nó ngay bây giờ và bắt đầu làm chủ nghệ thuật Trí tuệ Cảm xúc!",https://books.google.com/books/content?id=xGAOEQAAQBAJ&printsec=frontcover&img=1&zoom=1&edge=curl&source=gbs_api,N/A
199,ĐỪNG NGẠI HỌC,LINA VU,8,"Bạn đang cảm thấy mình chậm hơn người khác? Bạn muốn thay đổi công việc, tăng thu nhập, nâng cấp bản thân… nhưng không biết bắt đầu từ đâu? Hoặc bạn đã thử học nhiều lần nhưng bỏ dở giữa chừng? “Đừng Ngại Học” là cuốn sách dành cho người lớn bận rộn, những người vừa làm – vừa sống – vừa phải tự học để không bị bỏ lại phía sau trong thời đại biến động. Không phải thiên tài mới học tốt. Người bình thường chỉ cần đúng phương pháp. Cuốn sách này giúp bạn: Hiểu cách não người lớn học, tại sao bạn không kém mà chỉ “học khác”. Khám phá cách tập trung – kỷ luật – năng lượng để duy trì việc học dù rất bận. Nắm kỹ thuật học nhanh – học sâu như Pomodoro, Active Recall, Spaced Repetition, Feynman Technique… Biết học kỹ năng gì để tăng thu nhập 50–200% trong 1–2 năm. Xây dựng Hệ thống học tập cá nhân (Personal Learning System) 30–90 ngày. Biến kiến thức thành thu nhập thật qua chu trình Học – Làm – Tinh chỉnh. Trở thành người học trọn đời để mở ra nhiều cơ hội, tự do nghề nghiệp và tài chính. Cuốn sách phù hợp với: Người đang đi làm từ 20–40 tuổi. Người muốn thay đổi thu nhập, đổi nghề, nâng cấp kỹ năng. Người thấy mình thiếu tập trung, thiếu động lực, dễ bỏ cuộc. Người muốn học nhưng… “không biết học sao cho hiệu quả”. Người cần một hệ thống học rõ ràng – khoa học – dễ áp dụng. Điểm mạnh của cuốn sách: Viết dựa trên khoa học thần kinh, tâm lý học hành vi và phương pháp học hiện đại. Giọng văn thực tế – truyền cảm hứng – dễ áp dụng. Nhiều ví dụ thật, case study Việt Nam. Có bài tập, checklist, lộ trình, template rõ ràng. Trong kỷ nguyên AI và biến động, người không học không phải người thua kém – mà là người bị đào thải nhanh nhất. Bạn có thể thay đổi công việc, cấp số nhân thu nhập và mở lối sống tự do chỉ bằng một kỹ năng mới, một quyết định học lại từ đầu. Cuốn sách này sẽ là bản đồ giúp bạn không chỉ học tốt hơn, mà còn sống tốt hơn. 👉 Nếu bạn muốn 5 năm sau mình giàu hơn, tự do hơn, tự tin hơn — hãy bắt đầu bằng ĐỪNG NGẠI HỌC.",https://books.google.com/books/content?id=19uaEQAAQBAJ&printsec=frontcover&img=1&zoom=1&edge=curl&source=gbs_api,N/A
200,"Con 'Cai' điện thoại, cha mẹ đồng hành",Tran A,8,"Chào bạn, người cha, người mẹ đang trăn trở về việc con mình dành quá nhiều thời gian cho điện thoại! Trong thế giới hiện đại, điện thoại thông minh và các thiết bị điện tử đã trở thành một phần không thể thiếu trong cuộc sống. Chúng mang lại vô vàn tiện ích, nhưng đồng thời cũng tiềm ẩn những nguy cơ khôn lường, đặc biệt là đối với trẻ em. Không ít cha mẹ đang phải đối mặt với nỗi lo lắng khi con cái mình ngày càng phụ thuộc vào màn hình, bỏ bê học tập, ít giao tiếp, và thậm chí ảnh hưởng đến sức khỏe thể chất lẫn tinh thần. Bạn không đơn độc. Đây là một vấn đề chung của rất nhiều gia đình trong thời đại số. Cuốn sách nhỏ ""Con 'Cai' Điện Thoại, Cha Mẹ Đồng Hành"" này ra đời với mong muốn trở thành một người bạn đồng hành, một cẩm nang thiết thực dành cho các bậc phụ huynh. Chúng tôi sẽ không đưa ra những lời khuyên cao siêu hay những lý thuyết khô khan, mà thay vào đó là những chia sẻ gần gũi, những kinh nghiệm thực tế, và những bước đi cụ thể mà bạn có thể áp dụng ngay trong hành trình giúp con ""tạm biệt"" điện thoại, hướng tới một cuộc sống lành mạnh và ý nghĩa hơn. Hãy cùng chúng tôi khám phá những tác hại tiềm ẩn của việc lạm dụng điện thoại, nhận diện những dấu hiệu con bạn đang ""nghiện"", và quan trọng hơn cả, cùng nhau xây dựng một lộ trình từng bước để con bạn có thể cân bằng cuộc sống, phát triển toàn diện cả về thể chất lẫn tinh thần. Bạn sẽ tìm thấy các chương đi sâu vào: + Khi điện thoại trở thành ""kẻ cắp thời gian"" của con: Phân tích những ảnh hưởng tiêu cực của điện thoại đến sức khỏe, tinh thần, quan hệ xã hội và học tập của trẻ. + Nhận biết dấu hiệu và nguyên nhân con nghiện điện thoại: Giúp cha mẹ nhận biết các biểu hiện cụ thể và hiểu rõ lý do con dễ bị cuốn vào thế giới ảo. + Bước đệm cho hành trình ""cai nghiện"": Hướng dẫn cách thấu hiểu con, xây dựng quy tắc ""vàng"" cho cả gia đình và ""giải phóng"" không gian sống khỏi điện thoại. + Từng bước ""tạm biệt"" điện thoại: Áp dụng phương pháp ""cắt giảm"" dần thời gian sử dụng, thay thế bằng những ""niềm vui"" mới như đọc sách, thể thao, học nấu ăn, và tăng cường sức mạnh của trò chuyện, kết nối gia đình. + Kiến tạo cuộc sống lành mạnh toàn diện: Tập trung vào chăm sóc sức khỏe thể chất (ăn uống, vận động, giấc ngủ), nuôi dưỡng sức khỏe tinh thần (quản lý cảm xúc, môi trường yêu thương, thể hiện bản thân) và phát triển kỹ năng sống (tự lập, giao tiếp, sáng tạo) cho con. Hành trình này đòi hỏi sự kiên nhẫn, thấu hiểu và tình yêu thương vô bờ bến từ cha mẹ. Nhưng chúng tôi tin rằng, với sự đồng hành của bạn, con bạn sẽ tìm lại được niềm vui từ thế giới thực, khám phá những điều kỳ diệu xung quanh, và trở thành phiên bản tốt nhất của chính mình. Hãy cùng chúng tôi bắt đầu nhé!",https://books.google.com/books/content?id=k9ZqEQAAQBAJ&printsec=frontcover&img=1&zoom=1&edge=curl&source=gbs_api,N/A
201,Tư Duy Đấu Sĩ,Fususu,8,"Bạn đã từng cảm thấy bế tắc, thiếu tự tin vì những thành tích hay ngoại hình bình thường, tâm lý ngại giao tiếp, hay trì hoãn và mất phương hướng trong cuộc sống? Bạn đã sẵn sàng để đánh thức sức mạnh siêu tư duy và ""hạ gục"" mọi thách thức? Trong cuốn sách ""Tư Duy Đấu Sĩ"", tác giả bật mí hành trình vượt qua mọi thách thức để đạt được những mục tiêu ""không tưởng"" như trở thành huấn luyện viên siêu trí não, tác giả của hơn 10 cuốn sách đã xuất bản, vô địch về diễn thuyết hài hước ở 5 nước Đông Nam Á, và sống một cuộc sống tự do. Nam Phương tin rằng: Mọi thứ đều có thể, vấn đề là phương pháp. Tuy nhiên, chỉ biết phương pháp chưa đủ, bạn cần ""huấn luyện"" trí não để biến kỹ năng thành bản năng và thu hoạch những kết quả tuyệt vời. Thông qua cuốn sách này, bạn sẽ: - Khám phá sức mạnh tiềm ẩn bên trong, giúp bạn vượt qua giới hạn của bản thân. - Học những kỹ thuật đơn giản nhưng mạnh mẽ để giải quyết vấn đề, cả trong trường học và cuộc sống. - Trải nghiệm trực tiếp khả năng đáng kinh ngạc của ""bộ não thiên tài"", khiến bạn bất ngờ và thậm chí cả chính bản thân bạn. Áp dụng những nguyên tắc này, bạn sẽ tiết kiệm rất nhiều thời gian và tiền bạc đầu tư vào phát triển bản thân. Bạn sẽ biến những kỹ năng đã học thành bản năng, giúp bạn giải quyết mọi thách thức một cách nhanh chóng và thu hoạch những kết quả tuyệt vời mà bạn xứng đáng có được từ lâu. Hãy đọc ngay ""Tư Duy Đấu Sĩ"" và bắt đầu hành trình khám phá tiềm năng thật sự của bạn từ hôm nay!",https://books.google.com/books/content?id=rlP3EAAAQBAJ&printsec=frontcover&img=1&zoom=1&edge=curl&source=gbs_api,N/A
202,Tất Cả Đều Là Chuyện Nhỏ,Richard Carlson,8,"Mỗi khi đối mặt với tin xấu, một người khó chịu hay một nỗi thất vọng nào đó - đặc biệt là nghịch cảnh - hầu hết chúng ta thường có thói quen phản ứng lại cuộc sống theo những chiều hướng không mấy tốt đẹp. Chúng ta phản ứng thái quá, thổi phồng sự việc, bảo thủ, cứng nhắc hoặc chỉ tập trung vào những khía cạnh tiêu cực. Thực ra, khi bị những điều nhỏ nhặt níu chân - chẳng hạn khi bị chọc giận hoặc bị quấy rầy - phản ứng thái quá không chỉ khiến ta nản lòng mà còn cản trở ta đạt được cái mình mong muốn. Cuộc sống là cả một bức tranh lớn nhưng chúng ta chỉ săm soi vào những chi tiết nhỏ để rồi làm phiền cả những người có thể giúp đỡ mình. Nói ngắn gọn, chúng ta sống như thể mình đang ở trong tình trạng cực kỳ khẩn cấp! Chúng ta không hề nhận ra rằng trong mọi vấn đề, chúng ta đều có thể tìm thấy rất nhiều hướng giải quyết nhanh chóng và hiệu quả. Và một cách đơn giản để chúng ta thay đổi cuộc sống của chính mình là thay đổi những thói quen “phản ứng” cũ bằng những thói quen nhìn nhận mới. Các thói quen này sẽ cho phép chúng ta có được cuộc sống trọn vẹn hơn sau khi đã giải quyết đủ loại vấn đề - stress, trục trặc trong các mối quan hệ, công việc, cũng như những nỗi chán nản nói chung. Được khái quát thành 81 đề mục nhỏ với những mẩu chuyện, những lời khuyên, chia sẻ hoặc dẫn chứng về nội dung đang được đề cập, cuốn sách là một cẩm nang sống tuyệt vời. Qua “Tất cả đều là chuyện nhỏ”, Richard Carlson chia sẻ với các bạn lần lượt từng bí quyết nhỏ nhưng mang lại hiệu quả lớn - những điều bạn có thể thực hiện ngay từ hôm nay - để có một cuộc sống nhẹ nhàng thư thái, không bị vướng bận bởi những chuyện vặt vãnh, chẳng hạn như: • Hãy hỏi chính mình: “Có nên để việc này làm mình bận tâm suốt năm hay không?” • Làm điều tốt một cách thầm lặng. • Đừng cho rằng cuộc đời không công bằng với bạn. • Lắng nghe cảm giác của bạn. • Hãy nhớ rằng, khi bạn qua đời, “khay công việc” của bạn vẫn chưa hết. Cuốn sách trình bày các bí quyết đơn giản, nhưng hiệu quả và đóng vai trò dẫn đường cho bạn đến quan điểm sống tốt hơn cũng như một cách sống thư thái hơn. Bạn sẽ nhận thấy có nhiều bí quyết không chỉ áp dụng cho vài sự việc nhỏ nhất định mà còn cho nhiều thách thức lớn hơn của cuộc sống. Khi bạn không chấp nhặt những chuyện nhỏ, cuộc sống của bạn không phải ngay lập tức trở nên hoàn hảo, nhưng bạn sẽ học được cách chấp nhận những điều tự nhiên đang diễn ra xung quanh bạn. Nếu bạn áp dụng những bí quyết này, bạn sẽ học được hai nguyên tắc để sống một cách hòa hợp: 1) Đừng chấp nhặt những chuyện nhỏ 2) Tất cả đều là chuyện nhỏ. Sách được biên dịch từ cuốn Don’t sweat the small stuff của tác giả Richard Carlson, hiện phát hành tại các nhà sách trên toàn quốc. Mã hàng8935086854174Tên Nhà Cung CấpFIRST NEWSTác giảRichard CarlsonNgười DịchHiền LêNXBNXB Tổng Hợp TPHCMNăm XB2020Trọng lượng (gr)99Kích Thước Bao Bì15 x 10 x 1.2 cmSố trang199Hình thứcBìa MềmSản phẩm bán chạy nhấtTop 100 sản phẩm Kỹ năng sống bán chạy của thángGiá sản phẩm trên Fahasa.com đã bao gồm thuế theo luật hiện hành. Bên cạnh đó, tuỳ vào loại sản phẩm, hình thức và địa chỉ giao hàng mà có thể phát sinh thêm chi phí khác như Phụ phí đóng gói, phí vận chuyển, phụ phí hàng cồng kềnh,... Chính sách khuyến mãi trên Fahasa.com không áp dụng cho Hệ thống Nhà sách Fahasa trên toàn quốc Mỗi khi đối mặt với tin xấu, một người khó chịu hay một nỗi thất vọng nào đó - đặc biệt là nghịch cảnh - hầu hết chúng ta thường có thói quen phản ứng lại cuộc sống theo những chiều hướng không mấy tốt đẹp. Chúng ta phản ứng thái quá, thổi phồng sự việc, bảo thủ, cứng nhắc hoặc chỉ tập trung vào những khía cạnh tiêu cực. Thực ra, khi bị những điều nhỏ nhặt níu chân - chẳng hạn khi bị chọc giận hoặc bị quấy rầy - phản ứng thái quá không chỉ khiến ta nản lòng mà còn cản trở ta đạt được cái mình mong muốn. Cuộc sống là cả một bức tranh lớn nhưng chúng ta chỉ săm soi vào những chi tiết nhỏ để rồi làm phiền cả những người có thể giúp đỡ mình. Nói ngắn gọn, chúng ta sống như thể mình đang ở trong tình trạng cực kỳ khẩn cấp! Chúng ta không hề nhận ra rằng trong mọi vấn đề, chúng ta đều có thể tìm thấy rất nhiều hướng giải quyết nhanh chóng và hiệu quả. Và một cách đơn giản để chúng ta thay đổi cuộc sống của chính mình là thay đổi những thói quen “phản ứng” cũ bằng những thói quen nhìn nhận mới. Các thói quen này sẽ cho phép chúng ta có được cuộc sống trọn vẹn hơn sau khi đã giải quyết đủ loại vấn đề - stress, trục trặc trong các mối quan hệ, công việc, cũng như những nỗi chán nản nói chung. Được khái quát thành 81 đề mục nhỏ với những mẩu chuyện, những lời khuyên, chia sẻ hoặc dẫn chứng về nội dung đang được đề cập, cuốn sách là một cẩm nang sống tuyệt vời. Qua “Tất cả đều là chuyện nhỏ”, Richard Carlson chia sẻ với các bạn lần lượt từng bí quyết nhỏ nhưng mang lại hiệu quả lớn - những điều bạn có thể thực hiện ngay từ hôm nay - để có một cuộc sống nhẹ nhàng thư thái, không bị vướng bận bởi những chuyện vặt vãnh, chẳng hạn như: • Hãy hỏi chính mình: “Có nên để việc này làm mình bận tâm suốt năm hay không?” • Làm điều tốt một cách thầm lặng. • Đừng cho rằng cuộc đời không công bằng với bạn. • Lắng nghe cảm giác của bạn. • Hãy nhớ rằng, khi bạn qua đời, “khay công việc” của bạn vẫn chưa hết. Cuốn sách trình bày các bí quyết đơn giản, nhưng hiệu quả và đóng vai trò dẫn đường cho bạn đến quan điểm sống tốt hơn cũng như một cách sống thư thái hơn. Bạn sẽ nhận thấy có nhiều bí quyết không chỉ áp dụng cho vài sự việc nhỏ nhất định mà còn cho nhiều thách thức lớn hơn của cuộc sống. Khi bạn không chấp nhặt những chuyện nhỏ, cuộc sống của bạn không phải ngay lập tức trở nên hoàn hảo, nhưng bạn sẽ học được cách chấp nhận những điều tự nhiên đang diễn ra xung quanh bạn. Nếu bạn áp dụng những bí quyết này, bạn sẽ học được hai nguyên tắc để sống một cách hòa hợp: 1) Đừng chấp nhặt những chuyện nhỏ 2) Tất cả đều là chuyện nhỏ. Mời các bạn đón đọc Tất Cả Đều Là Chuyện Nhỏ của tác giả Richard Carlson.",https://books.google.com/books/content?id=V1nGEAAAQBAJ&printsec=frontcover&img=1&zoom=1&edge=curl&source=gbs_api,N/A
