id,title,author,category_id,description,img_url,isbn
84,Lịch Sử Việt Nam Thời Tự Chủ - Tập Hai (lightweight paper - soft cover),Bach Thao Ho,5,"Vướng chút cơ duyên về lịch sử, tôi có dịp dịch các tư liệu Việt sử trong các bộ sử Trung Quốc như Nhị Thập Ngũ Sử, Tư Trị Thông Giám, Tục Tư Trị Thông Giám Trường Biên, Minh Thực Lục, Thanh Thực Lục. Một số tư liệu được in trong các sách xuất bản tại Hoa Kỳ như Những Nét Đặc Trưng Về Lịch Sử Việt Nam, Việt Sử Tư Liệu Và Lời Bàn; tại trong nước như Minh Thực Lục, Thanh Thực Lục. Tuy đã về già, nhưng cảm thấy bổn phận chưa hoàn thành; nên mấy năm nay lại làm công tác tổng hợp, gộp các sử liệu nêu trên với các bộ sử lớn Việt Nam như Toàn Thư, Khâm Định, Đại Nam Thực Lục, nhắm hoàn thành sách mới, với nhan đề Lịch Sử Việt Nam Thời Tự Chủ. Bộ sử này khởi đầu từ thời Khúc Tiên Chúa giành độc lập [906], cho đến hiện đại. Nhờ tư liệu phong phú, nên hiện nay tuy mới soạn đến giai đoạn Vua Quang Trung đại phá quân Thanh [1789]; tính ra chưa đầy 900 năm, đã hoàn thành được 2000 trang; xét về số lượng, quả là dồi dào! A century ago, scholar Tran Trong Kim published a history book, less than 1,000 pages, named ""Việt Nam Sử Lược"" which covers the period of 4,000 years Vietnamese history. In the present, thanks to more documents from old Vietnamese and Chinese history; I have completed the book named ""Lịch Sử Việt Nam Thời Tự Chủ"" (2,000 pages), presents 900 years in the independent time. Historic lovers, please read it for valuable documents! Thank you. Hồ Bạch Thảo",https://books.google.com/books/content?id=WC5Y0AEACAAJ&printsec=frontcover&img=1&zoom=1&source=gbs_api,9798869004895
85,LỊCH SỬ VIỆT NAM DỄ HIỂU CHO HỌC SINH – SINH VIÊN,Vivian Vu,5,"Cuốn sách giúp bạn hiểu và tự hào hơn về dòng chảy hơn 4000 năm lịch sử dân tộc Việt Nam – từ buổi dựng nước Văn Lang đến thời kỳ hội nhập hiện nay. Đây không chỉ là một cuốn sách lịch sử Việt Nam dễ hiểu, mà còn là hành trình tư duy, giúp người đọc – đặc biệt là người trẻ thời 4.0 – cảm nhận được tinh thần kiên cường, lòng yêu nước và trí tuệ dân tộc qua từng thời kỳ. 📖 Nội dung nổi bật: Tóm lược mốc lịch sử Việt Nam qua 10 chương sinh động, cô đọng, dễ nhớ. Khắc họa những anh hùng, danh nhân, sự kiện lớn: từ Hai Bà Trưng, Ngô Quyền, Lý Thường Kiệt, Trần Hưng Đạo, Quang Trung đến thời kỳ Đổi Mới. Giải mã tư duy và bài học từ lịch sử – vì “lịch sử không chỉ là quá khứ, mà là tấm gương soi cho tương lai”. Phụ lục đặc biệt: timeline lịch sử, bảng nhân vật & sự kiện tiêu biểu, trắc nghiệm ôn tập nhanh, trích dẫn truyền cảm hứng về tinh thần Việt Nam. 📚 Phù hợp với: Học sinh, sinh viên, người trẻ muốn hiểu gốc rễ dân tộc mình. Người yêu lịch sử Việt Nam nhưng muốn đọc bản tóm lược, dễ tiếp cận, không khô khan. Giáo viên, phụ huynh muốn truyền cảm hứng lịch sử cho thế hệ sau. ✨ Tại sao nên đọc cuốn sách này: Vì để bước đi vững vàng trong tương lai, ta phải hiểu quá khứ của chính dân tộc mình. “Hành Trình Lịch Sử Việt Nam” không chỉ kể chuyện – mà giúp bạn suy ngẫm, tự hào và học được tư duy dân tộc đã giúp người Việt vượt qua nghìn năm thử thách.",https://books.google.com/books/content?id=mYSPEQAAQBAJ&printsec=frontcover&img=1&zoom=1&edge=curl&source=gbs_api,N/A
86,L¿ch S¿ Vi¿t Nam Th¿i T¿ Ch¿ - T¿p N¿m (lightweight paper - soft cover),Bach Thao Ho,5,"Vướng chút cơ duyên về lịch sử, tôi có dịp dịch các tư liệu Việt sử trong các bộ sử Trung Quốc như Nhị Thập Ngũ Sử, Tư Trị Thông Giám, Tục Tư Trị Thông Giám Trường Biên, Minh Thực Lục, Thanh Thực Lục. Một số tư liệu được in trong các sách xuất bản tại Hoa Kỳ như Những Nét Đặc Trưng Về Lịch Sử Việt Nam, Việt Sử Tư Liệu Và Lời Bàn; tại trong nước như Minh Thực Lục, Thanh Thực Lục. Tuy đã về già, nhưng cảm thấy bổn phận chưa hoàn thành; nên mấy năm nay lại làm công tác tổng hợp, gộp các sử liệu nêu trên với các bộ sử lớn Việt Nam như Toàn Thư, Khâm Định, Đại Nam Thực Lục, nhắm hoàn thành sách mới, với nhan đề Lịch Sử Việt Nam Thời Tự Chủ. Bộ sử này khởi đầu từ thời Khúc Tiên Chúa giành độc lập [906], cho đến hiện đại. Nhờ tư liệu phong phú, nên hiện nay tuy mới soạn đến giai đoạn Vua Quang Trung đại phá quân Thanh [1789]; tính ra chưa đầy 900 năm, đã hoàn thành được 2000 trang; xét về số lượng, quả là dồi dào! .... Hồ Bạch Thảo A century ago, scholar Tran Trong Kim published a history book, less than 1,000 pages, named ""Việt Nam Sử Lược"" which covers the period of 4,000 years Vietnamese history. In the present, thanks to more documents from old Vietnamese and Chinese history; I have completed the book named ""Lịch Sử Việt Nam Thời Tự Chủ"" (2,000 pages), presents 900 years in the independent time. Historic lovers, please read it for valuable documents! Thank you. Ho Bach Thao",https://books.google.com/books/content?id=Gyxj0AEACAAJ&printsec=frontcover&img=1&zoom=1&source=gbs_api,9798869050908
87,L¿ch S¿ Vi¿t Nam Th¿i T¿ Ch¿ - T¿p Ba (lightweight paper - soft cover),Bach Thao Ho,5,"Vướng chút cơ duyên về lịch sử, tôi có dịp dịch các tư liệu Việt sử trong các bộ sử Trung Quốc như Nhị Thập Ngũ Sử, Tư Trị Thông Giám, Tục Tư Trị Thông Giám Trường Biên, Minh Thực Lục, Thanh Thực Lục. Một số tư liệu được in trong các sách xuất bản tại Hoa Kỳ như Những Nét Đặc Trưng Về Lịch Sử Việt Nam, Việt Sử Tư Liệu Và Lời Bàn; tại trong nước như Minh Thực Lục, Thanh Thực Lục. Tuy đã về già, nhưng cảm thấy bổn phận chưa hoàn thành; nên mấy năm nay lại làm công tác tổng hợp, gộp các sử liệu nêu trên với các bộ sử lớn Việt Nam như Toàn Thư, Khâm Định, Đại Nam Thực Lục, nhắm hoàn thành sách mới, với nhan đề Lịch Sử Việt Nam Thời Tự Chủ. Bộ sử này khởi đầu từ thời Khúc Tiên Chúa giành độc lập [906], cho đến hiện đại. Nhờ tư liệu phong phú, nên hiện nay tuy mới soạn đến giai đoạn Vua Quang Trung đại phá quân Thanh [1789]; tính ra chưa đầy 900 năm, đã hoàn thành được 2000 trang; xét về số lượng, quả là dồi dào! A century ago, scholar Tran Trong Kim published a history book, less than 1,000 pages, named ""Việt Nam Sử Lược"" which covers the period of 4,000 years Vietnamese history. In the present, thanks to more documents from old Vietnamese and Chinese history; I have completed the book named ""Lịch Sử Việt Nam Thời Tự Chủ"" (2,000 pages), presents 900 years in the independent time. Historic lovers, please read it for valuable documents! Thank you. Hồ Bạch Thảo",https://books.google.com/books/content?id=JT5f0AEACAAJ&printsec=frontcover&img=1&zoom=1&source=gbs_api,9798869019967
88,Vua trẻ trong lịch sử Việt Nam,Ngọc Khánh Vũ,5,"Giới thiệu chân dung các vị vua chúa trẻ trong lịch sử Việt Nam lên ngôi từ độ tuổi thanh thiếu niên đến trên 40 tuổi: Mai Hắc Đế, ngô Vương Quyền, Đinh Tiên Hoàng, Lê Đại Hành,Trịnh Càn, Gia Long, Bảo Đại...",https://books.google.com/books/content?id=Nkx_8Sh4sT8C&printsec=frontcover&img=1&zoom=1&source=gbs_api,WISC:89092015692
89,"Định hướng chiến lược phát triển khoa học và công nghệ khu vực kinh tế hợp tác, hợp tác xã đến năm 2020",Xuân Hiên Nguyễn (Writer on economics),6,Strategy orientation on the science and technology development in the economic cooperative sector in Vietnam.,https://books.google.com/books/content?id=eNU3upW2OMEC&printsec=frontcover&img=1&zoom=1&source=gbs_api,UCR:31210024627091
90,Những luận cứ khoa học về đổi mới chính sách xã hội đối với giai cấp công nhân và thợ thủ công Việt Nam,Unknown,6,"Hai mươi năm luận cứ khoa học vè̂ các quan điẻ̂m lý luận, phương pháp luận, nhận thức thực tiẽ̂n, tư duy hoạch định chính sách, tư tưởng chính sách, mô hình và nội dung cơ bản của chính sách, mô hình cơ ché̂ hoạch định và quản lý chính sách cho công nhân và thợ thủ công ở Việt Nam.",https://books.google.com/books/content?id=2rz1WES1OjcC&printsec=frontcover&img=1&zoom=1&source=gbs_api,WISC:89061389847
91,Cách mạng tháng mười Nga và một số vấn đề cấp bách về thời đại ngày nay,Unknown,6,"History of the October revolution, 1917 in Russia.",https://books.google.com/books/content?id=TYXzFjOAvBAC&printsec=frontcover&img=1&zoom=1&source=gbs_api,UOM:39015073832118
92,Tăng cường sự lãnh đạo của Đảng và công tác chính trị trong quân đội,Chí Thanh Nguyễn,6,Collection of talks and articles by General Nguyen Chi Thanh (1914-1967) about political/ideological tasks in the the military.,https://books.google.com/books/content?id=3oO9p1X3lrQC&printsec=frontcover&img=1&zoom=1&source=gbs_api,UCAL:B5480308
93,Kỷ yếu ban chấp hành Đảng bộ tỉnh Quảng Ngãi (1930-2015).,Unknown,6,List of official personnel of the Quang Ngai Provincial Party Executive Committee over the period 1930-2015.,https://books.google.com/books/content?id=rJZIV-IkyyMC&printsec=frontcover&img=1&zoom=1&source=gbs_api,UCR:31210025328905
94,"Về phát triển văn hóa và xây dựng con người thời kỳ công nghiệp hóa, hiện đại hóa",Unknown,6,"Trình bày những nội dung cơ bản về tư tưởng Hồ Chí Minh đối với phát triển văn hoá và xây dựng con người; mối quan hệ giữa văn hoá và phát triển trong thời kỳ đổi mới, phát triển toàn diện con người và xây dựng lối sống, đạo đức và chuẩn giá trị mới, một số vấn đề dân tộc và tôn giáo, ...một số khuyến nghị và giải pháp cho các vấn đề trên.",https://books.google.com/books/content?id=GdZwAAAAMAAJ&printsec=frontcover&img=1&zoom=1&source=gbs_api,UOM:39015052966911
95,Southeast Asian Periodicals,Unknown,6,Union list (catalogue) of periodicals on South East Asia together with locations of holdings in libraries throughout the world.,https://books.google.com/books/content?id=j3ngAAAAMAAJ&printsec=frontcover&img=1&zoom=1&source=gbs_api,UOM:39015078825208
96,Tài liệu nghiên cứu nghị quyết Hội nghị lần thứ tư Ban chấp hành trung ương Đảng cộng sản Việt Nam khóa XI,Tiến Hoàng Nguyễn,6,"Research on resolutions of the 4th conference of central executive committee of the Communist Party of Vietnam, session XI.",https://books.google.com/books/content?id=1oPnXmV1DYYC&printsec=frontcover&img=1&zoom=1&source=gbs_api,UOM:39015088204402
97,Xây dựng đời sống văn hóa,Unknown,6,Social life in Vietnam,https://books.google.com/books/content?id=T1iSCpPvd7EC&printsec=frontcover&img=1&zoom=1&source=gbs_api,CORNELL:31924105074995
98,Phạm Văn Đồng tuyển tập: 1976-2000,Văn Đồng Phạm,6,"Selected writings of Phạm Văn Đồng, Vietnamese Prime Minister.",https://books.google.com/books/content?id=GUdRAQAAMAAJ&printsec=frontcover&img=1&zoom=1&source=gbs_api,UCBK:C102564533
99,Diem's Final Failure,Philip E. Catton,6,"""Catton treats the Diem government on its own terms rather than as an appendage of American policy. Focusing on the decade from Dien Bien Phu to Diem's assassination in 1963, he examines the Vietnamese leader's nation-building and reform efforts - particularly his Strategic Hamlet Program, which sought to separate guerrilla insurgents from the peasantry and build grassroots support for his regime. Catton's evaluation of the collapse of that program offers fresh insights into both Diem's limitations as a leader and the ideological and organizational weaknesses of his government, while his assessment of the evolution of Washington's relations with Saigon provides new insight into America's growing involvement in the Vietnamese civil war."".",https://books.google.com/books/content?id=eV5uAAAAMAAJ&printsec=frontcover&img=1&zoom=1&edge=curl&source=gbs_api,UOM:39015055920824
100,Người vô hình,H.G. Wells,6,"Bắt nguồn từ nhu cầu che giấu bản thân và thể hiện quyền lực siêu nhiên, từ ngàn xưa con người đã có khát vọng được làm chủ khả năng tàng hình. Ước mơ đó được thể hiện từ truyền thuyết về chiếc mũ tàng hình của Hades trong thần thoại Hy Lạp đến chiếc áo choàng màu nhiệm của Harry Potter. Nhà triết học Plato từ hơn 2000 năm trước đã đặt ra câu hỏi: “Liệu rằng con người sẽ thay đổi ra sao khi chúng ta nắm giữ được khả năng tàng hình?”. Năm 1897, quyển tiểu thuyết khoa học viễn tưởng Người Vô Hình của nhà văn H. G. Wells ra đời đã trả lời cho câu hỏi của Plato dưới góc nhìn của một nhà khoa học. Nhưng “Người vô hình” không chỉ là câu chuyện khoa học viễn tưởng, mà còn là câu chuyện về cái thiện và cái ác, câu chuyện về quyền lực và sự suy đồi đạo đức. Quyền lực là mảnh đất màu mỡ cho những hạt mầm xấu nảy sinh. Một khi con người chạm vào đỉnh cao quyền lực, lòng tham và cái ác sẽ trỗi dậy. Quyền lực làm người ta tha hóa. Quyền lực tuyệt đối sẽ dẫn đến cái ác tuyệt đối.",https://books.google.com/books/content?id=4Xr3DwAAQBAJ&printsec=frontcover&img=1&zoom=1&edge=curl&source=gbs_api,9786046995562
101,Chứng nhận nghiên cứu khoa học – 4,Андрей Тихомиров,6,"Cuốn sách thảo luận về các chủ đề sau, đã nhận được xác nhận khoa học hơn nữa: trí tuệ nhân tạo; đánh giá khoa học về dự báo và dự đoán; tiết lộ những bí mật của bộ não.",https://books.google.com/books/content?id=v1D1EAAAQBAJ&printsec=frontcover&img=1&zoom=1&edge=curl&source=gbs_api,9785046043419
102,Tiếng Hàn tiêu chuẩn tập 2,Bộ giáo dục khoa học và kỹ thuật Hàn Quốc,6,"Nối tiếp những bài học mở đầu của tập 1. Ở tập hai này, người học sẽ được học thêm những kiến thức ngữ pháp cơ bản nhất. Rất dễ dàng cho từng bước tự học",https://books.google.com/books/content?id=mLIKEQAAQBAJ&printsec=frontcover&img=1&zoom=1&edge=curl&source=gbs_api,N/A
103,Hiểu hết về Trà,"Brian R. Keating, Kim Long",6,"Khoa học và nghệ thuật ẩn sau những chiếc lá Các chuyên gia về trà Brian Keating và Kim Long sẽ chỉ cho bạn mọi điều cần thiết để pha được một chén trà đúng ý. Hiểu hết về Trà nhắc lại một sự thật có lẽ không nhiều người chú ý: mọi loại trà ngày nay, từ Lập Sơn thanh tao đến Phổ Nhĩ nồng chát, đều có chung nguồn gốc. Vậy sự khác biệt là do đâu? Chính các yếu tố mang tính khoa học như địa lý, sinh học, hóa học và vật lý, sự ứng dụng nhiệt và áp lực, cùng sự diệu kỳ của thời gian và enzyme đã cùng nhau làm nên hàng trăm, hàng nghìn loại trà trên thế giới. Thông qua Hiểu hết về Trà, những kỹ thuật, công cụ và phương pháp pha trà tại nhà cũng được tác giả giới thiệu tới bạn đọc, giúp mỗi người đều có cơ hội trở nên thành thục nghệ thuật này. Hiểu hết về Trà là cuốn cẩm nang đầy đủ và hấp dẫn dành cho người yêu trà, bao gồm mọi khía cạnh khoa học và nghệ thuật. Tất thảy – loại lá trà và số lượng, kỹ thuật pha nước và thời gian ngâm trà – đều được các tác giả chỉ dẫn từng bước cụ thể kèm hình minh họa. Bằng những hiểu biết về danh mục trà xanh, trà đen, trà trắng và trà ô long, cách thử nếm và lưu giữ trà tại nhà được nêu ra trong sách, người yêu trà có thể tự khám phá và lựa chọn loại trà phù hợp nhất, đúng “gu” nhất, từ đó tận hưởng vẻ đẹp và lợi ích của món uống tinh tế này. CUỐN SÁCH CÓ GÌ ĐẶC BIỆT - Hiểu hết về Trà giới thiệu trà trên khía cạnh khoa học dành cho những người không phải là nhà khoa học, đi kèm hướng dẫn bằng minh họa từng bước để đưa người đọc từ đam mê đơn thuần thành đam mê một cách chuyên nghiệp. - Ngắn gọn, súc tích, đầy đủ những gì một người yêu trà và bắt đầu tìm hiểu về trà cần đọc (để pha được một chén trà thơm ngon). - Một hướng dẫn tường minh và thu hút về thành phần hóa học của trà - Bao hàm toàn diện mọi phương pháp pha trà - Cuốn sổ tay mọi-thứ-về-trà vô giá cho những người yêu trà CUỐN SÁCH DÀNH CHO - Những ai muốn biết cách pha một chén trà thơm ngon, ""đúng vị"" và có lợi cho sức khỏe. - Những người tò mò về nguồn gốc lịch sử, địa lý của cây trà; có hứng thú tìm hiểu những đặc tính hóa học và vật lý của cây trà. - Những ai muốn tìm câu trả lời cho câu hỏi: Việt Nam xếp ở đâu trên bản đồ ngành trà thế giới?",https://books.google.com/books/content?id=dzxcEQAAQBAJ&printsec=frontcover&img=1&zoom=1&edge=curl&source=gbs_api,N/A
104,Phương pháp luận nghiên cứu khoa học,Nguyẽ̂n Văn Lê,6,"Các khái nịêm khoa học và nghiên ćưu khoa học. Chọn đ̀ê tài và chủân bị nghiên ćưu. Các phương pháp: Chọn m̃âu thăm dò xã ḥôi học, quan sát, thí nghịêm, tŕăc nghịêm. X̉ư lý d̃ư lịêu, dĩên giải. Phương pháp th́ông kê x̉ư lý và phân tích các d̃ư lịêu. Báo cáo ḱêt quả nghiên ćưu khoa học. V́ân đ̀ê chuỷên giao công ngḥê, t̉ô ch́ưc và quản lý công tác nghiên ćưu khoa học.",https://books.google.com/books/content?id=Yoz6m--DZUUC&printsec=frontcover&img=1&zoom=1&source=gbs_api,CORNELL:31924078423096
105,Sách DẠy NẤu Ăn Ma-RỐc TỐt NhẤt,NguyỆt DiỆp,7,"Marhaban! Chào mừng bạn đến với ""Sách dạy nấu ăn Ma-rốc cơ bản"", cánh cửa giúp bạn khám phá thế giới ẩm thực Ma-rốc vượt thời gian và đầy mê hoặc thông qua 100 công thức nấu ăn hiện đại. Cuốn sách nấu ăn này tôn vinh tấm thảm phong phú về hương vị, gia vị thơm và truyền thống ẩm thực đã định hình nên phong cách nấu ăn của người Ma-rốc. Hãy tham gia cùng chúng tôi trong hành trình ẩm thực mang nét quyến rũ của Ma-rốc vào nhà bếp của bạn, pha trộn truyền thống với nét hiện đại. Hãy hình dung một chiếc bàn được trang trí bằng những món tagines thơm ngát, những món couscous sôi động và những chiếc bánh ngọt hảo hạng-tất cả đều lấy cảm hứng từ phong cảnh đa dạng và ảnh hưởng văn hóa của Maroc. ""Cuốn sách dạy nấu ăn Ma-rốc cơ bản"" không chỉ là một bộ sưu tập các công thức nấu ăn; đó là sự khám phá các nguyên liệu, kỹ thuật và những câu chuyện đã khiến ẩm thực Ma-rốc trở thành một bản giao hưởng của hương vị. Cho dù bạn có nguồn gốc từ Ma-rốc hay chỉ đơn giản là đánh giá cao hương vị đậm đà và thơm ngon của Bắc Phi, những công thức nấu ăn này được tạo ra để hướng dẫn bạn vượt qua sự phức tạp trong cách nấu ăn của Ma-rốc. Từ món tagines cổ điển như thịt cừu với quả mơ cho đến món bánh couscous biến tấu hiện đại và bánh ngọt sáng tạo, mỗi công thức là sự tôn vinh sự tươi ngon, gia vị và lòng hiếu khách đã tạo nên nét đặc trưng cho các món ăn Ma-rốc. Cho dù bạn đang tổ chức một buổi họp mặt lễ hội hay thưởng thức một bữa ăn gia đình ấm cúng, cuốn sách nấu ăn này là nguồn tài liệu tham khảo để mang hương vị đích thực của Maroc đến bàn ăn của bạn. Hãy tham gia cùng chúng tôi khi chúng tôi đi ngang qua các phong cảnh ẩm thực của Marrakech đến Chefchaouen, nơi mỗi sáng tạo là một minh chứng cho hương vị sống động và đa dạng đã khiến cách nấu ăn của người Ma-rốc trở thành một truyền thống ẩm thực được yêu mến. Vì vậy, hãy đeo tạp dề vào, đón nhận tinh thần hiếu khách của người Ma-rốc và hãy bắt đầu một cuộc hành trình thú vị thông qua ""Sách dạy nấu ăn Ma-rốc cơ bản"".",https://books.google.com/books/content?id=hySv0AEACAAJ&printsec=frontcover&img=1&zoom=1&source=gbs_api,1836234600
106,Truyen ngon tinh - Cho mot ngay nang,Diep Linh Chi,7,"In spite of coming from a rich family, Tieu Tinh is not like a rich girl. Her fiance is arrogant and cold man, who cheated her when she has just arrived to the United States. However, she still must get marriaged to him. What will happen to her?",https://books.google.com/books/content?id=KvPxCwAAQBAJ&printsec=frontcover&img=1&zoom=1&edge=curl&source=gbs_api,9786046900863
107,27000 Vietnamese Words Dictionary With Definitions,Nam H Nguyen,7,"27000 Từ điển Anh-Việt Với Định nghĩa s là một nguồn tài nguyên tuyệt vời ở bất cứ đâu bạn đi; nó là một công cụ dễ dàng chỉ có những từ hoàn thành mô tả bạn muốn và cần! Toàn bộ từ điển là một danh sách theo thứ tự chữ cái các từ tiếng Anh với mô tả đầy đủ của chúng cùng với Bảng chữ cái đặc biệt , Động từ bất quy tắc và các phần của lời nói. Nó sẽ trở nên hoàn hảo và rất hữu ích cho tất cả những ai cần một nguồn đáng tin cậy có ích cho gia đình, trường học, văn phòng, tổ chức, sinh viên, cán bộ đại học, chính phủ, các nhà ngoại giao, các viện nghiên cứu, các chuyên gia, b usiness người, công ty, du lịch, phiên dịch, tham khảo và học tiếng Anh. Ý nghĩa của những từ bạn sẽ học sẽ giúp bạn trong bất kỳ tình huống trong lòng bàn tay của bạn. Chỉ cần nhớ một điều mà việc học không bao giờ dừng lại! Đọc đọc đọc! Và Viết, Viết, Viết! Một lời cảm ơn đến người vợ tuyệt vời của tôi Beth ( Griffo ) Nguyễn và các con trai tuyệt vời của tôi, Taylor Nguyễn và Ashton Nguyễn vì tất cả tình yêu và sự hỗ trợ của họ, mà không có sự hỗ trợ và giúp đỡ về tình cảm của họ.",https://books.google.com/books/content?id=FamMDwAAQBAJ&printsec=frontcover&img=1&zoom=1&edge=curl&source=gbs_api,N/A
108,Mật Mã Tâm Linh,Tất Thục Mẫn,7,"Tâm linh vốn không có mật mã nhưng mật mã thì ở đâu cũng có! Trong cuộc đời thứ gì là quan trọng nhất? Làm thế nào để nhận ra quý nhân trong cuộc đời? Tình yêu của cô ấy tại sao luôn kết thúc lại không có vấn đề gì? Cái gì làm cho phụ nữ trở nên xấu xí?... Cuốn sách này là tác phẩm mới nhất của Tất Thục Mẫn sau nhiều năm trăn trở. Tác giả dựa trên kinh nghiệm là nhà văn, bác sỹ, nhà tâm lý, dựa trên bối cảnh tâm lý học và những trải nghiệm quý báu của cuộc đời để viết tác phẩm này, đi sâu vào tâm linh mỗi người, mở khóa những bí ẩn tâm linh. Mời bạn đón đọc.",https://books.google.com/books/content?id=fGvQEAAAQBAJ&printsec=frontcover&img=1&zoom=1&edge=curl&source=gbs_api,N/A
