id,title,author,category_id,description,img_url,isbn
162,Cu¿n sách n¿u món th¿t viên rau không th¿ c¿¿ng l¿i,"Ph¿¿ng Linh, Phương Linh",7,"Chào mừng đến với thế giới thịt viên rau củ! Trong cuốn sách dạy nấu ăn này, chúng tôi mời bạn khám phá những khả năng ngon miệng và bổ dưỡng của món thịt viên làm từ thực vật. Thịt viên rau củ mang đến một cách sáng tạo và thỏa mãn để thưởng thức hương vị và kết cấu của rau củ đồng thời cung cấp một sự thay thế bổ dưỡng cho thịt viên truyền thống. Cuốn sách nấu ăn này là hướng dẫn giúp bạn nắm vững nghệ thuật chế biến thịt viên rau củ và tạo ra những món ăn bổ dưỡng và đầy hương vị sẽ làm hài lòng cả người ăn chay và những người yêu thích thịt. Thịt viên rau củ là minh chứng cho sự linh hoạt và phong phú của các nguyên liệu có nguồn gốc thực vật. Từ đậu lăng và đậu xanh đến nấm và hạt diêm mạch, khả năng tạo ra các món thay thế thịt viên ngon là vô tận. Trong cuốn sách nấu ăn này, chúng tôi tôn vinh sự phong phú và đa dạng của thịt viên rau củ, đồng thời giới thiệu cho bạn một bộ sưu tập các công thức kết hợp các loại rau củ, ngũ cốc và gia vị khác nhau để tạo ra những món ăn ngon miệng vừa ngon miệng vừa bổ dưỡng. Trong những trang này, bạn sẽ khám phá ra một kho tàng công thức nấu ăn thể hiện sự sáng tạo và hương vị của món thịt viên rau củ. Từ thịt viên kiểu Ý cổ điển với cách chế biến từ thực vật cho đến những món sáng tạo lấy cảm hứng từ toàn cầu kết hợp nhiều loại thảo mộc và gia vị, chúng tôi đã tuyển chọn một bộ sưu tập sẽ đưa vị giác của bạn vào một hành trình đầy hương vị. Mỗi công thức được thiết kế để cung cấp cho bạn sự kết hợp cân bằng giữa hương vị, kết cấu và chất dinh dưỡng, đảm bảo trải nghiệm ăn uống hài lòng và thú vị. Nhưng cuốn sách nấu ăn này không chỉ là một tập hợp các công thức nấu ăn thịt viên rau củ. Chúng tôi sẽ hướng dẫn bạn nghệ thuật tạo kết cấu và hương vị giống như thịt viên bằng cách sử dụng các nguyên liệu có nguồn gốc thực vật, đưa ra các mẹo về chất kết dính và gia vị, đồng thời chia sẻ các kỹ thuật để đạt được kết cấu và độ đặc hoàn hảo. Cho dù bạn là một đầu bếp dày dạn kinh nghiệm làm từ thực vật hay mới làm quen với thế giới thịt viên rau củ, mục tiêu của chúng tôi là hỗ trợ bạn tạo ra những món ăn ngon và bổ dưỡng sẽ làm hài lòng vị giác và nuôi dưỡng cơ thể của bạn. Vì vậy, cho dù bạn đang tìm kiếm một giải pháp thay thế lành mạnh hơn cho món thịt viên truyền thống, khám phá cách ăn uống dựa trên thực vật hay chỉ đơn giản là muốn kết hợp nhiều loại rau hơn vào chế độ ăn uống của mình, hãy để cuốn ""Từ vườn đến đĩa: Cuốn sách nấu ăn từ thịt viên bằng rau củ"" hướng dẫn cho bạn. Hãy sẵn sàng để thưởng thức sự sáng tạo và hương vị của món thịt viên rau củ, đồng thời bắt đầu một hành trình đầy hương vị nhằm tôn vinh sự phong phú và linh hoạt của các nguyên liệu có nguồn gốc thực vật.",https://books.google.com/books/content?id=FDAn0AEACAAJ&printsec=frontcover&img=1&zoom=1&source=gbs_api,1835512933
163,Sách NẤu Ăn Chimichuri TuyỆt VỜi,Dung Trang,7,"Chào mừng bạn đến với ""Sách dạy nấu ăn Chimichurri đỉnh cao"", hộ chiếu để bạn khám phá thế giới sôi động và linh hoạt của nước sốt chimichurri. Có nguồn gốc từ Argentina, chimichurri là một loại gia vị có hương vị thảo mộc đã trở thành món ăn không thể thiếu trong các nhà bếp trên toàn cầu. Trong cuốn sách nấu ăn toàn diện này, chúng tôi mời bạn khám phá những khả năng vô tận của chimichurri, từ cách nướng cổ điển truyền thống đến những cách chế biến hiện đại đầy sáng tạo. Nước sốt Chimichurri là một tuyệt tác ẩm thực, được biết đến với hương vị tươi sáng, các loại thảo mộc thơm và hương vị nồng nàn. Mặc dù nó thường được kết hợp với các loại thịt nướng nhưng tính linh hoạt của chimichurri là không có giới hạn. Trong cuốn sách này, bạn sẽ học cách sử dụng chimichurri để nâng tầm nhiều món ăn, từ hải sản và rau củ đến mì ống và bánh mì sandwich. Cho dù bạn là một đầu bếp dày dặn kinh nghiệm hay một người nấu ăn tại nhà đang muốn tăng thêm sự hứng thú cho bữa ăn của mình thì ""Cuốn sách dạy nấu ăn Chimichurri đỉnh cao"" đều có thứ gì đó dành cho tất cả mọi người. Với hơn 100 công thức nấu ăn được tuyển chọn tỉ mỉ để giới thiệu các ứng dụng đa dạng của chimichurri, bạn sẽ bắt tay vào hành trình ẩm thực tôn vinh sự sáng tạo, hương vị và sự khám phá. Hãy tham gia cùng chúng tôi khi chúng tôi đi sâu vào thế giới chimichurri, khám phá lịch sử phong phú, ý nghĩa văn hóa và tiềm năng ẩm thực của nó. Với các công thức nấu ăn dễ thực hiện, các mẹo hữu ích và hình ảnh tuyệt đẹp hướng dẫn bạn trong quá trình thực hiện, cuốn sách nấu ăn này là nguồn tài liệu chính xác để bạn nắm vững nghệ thuật chimichurri và kết hợp nó vào các tiết mục nấu ăn hàng ngày của bạn. Vì vậy, hãy thu thập nguyên liệu, mài dao và chuẩn bị thưởng thức hương vị sống động của chimichurri trong nhà bếp của bạn. Cho dù bạn đang nướng một bữa tiệc ở sân sau hay chuẩn bị một bữa tối nhanh chóng vào cuối tuần, ""Sách dạy nấu ăn Chimichurri tối thượng"" là hướng dẫn cần thiết để bạn trải nghiệm sự kỳ diệu của loại nước sốt mang tính biểu tượng này trong từng miếng ăn.",https://books.google.com/books/content?id=sRS10AEACAAJ&printsec=frontcover&img=1&zoom=1&source=gbs_api,183623161X
164,N¿U ¿N V¿I TH¿O D¿¿C T¿¿I,Nghi Thanh,7,"Không có quy tắc chung về lượng thảo mộc cần sử dụng. Hầu hết các công thức nấu ăn đều chỉ định một lượng trong danh sách nguyên liệu. Nếu bạn không có công thức để làm theo, hãy bắt đầu với 1/4 thìa cà phê và thêm nhiều hơn nếu cần để đạt được hương vị lý tưởng. Bạn không muốn các loại thảo mộc lấn át các hương vị khác trong món ăn. Các loại thảo mộc khô có tác dụng mạnh hơn các loại thảo mộc tươi nên bạn sẽ cần sử dụng nhiều loại thảo mộc tươi hơn. Nếu công thức yêu cầu 1 thìa cà phê thảo mộc khô, nghiền nát hoặc 1/4 thìa cà phê thảo mộc dạng bột, hãy sử dụng 3 thìa cà phê (1 thìa canh) thảo mộc tươi. hỗn hợp thảo mộc khô là lựa chọn tuyệt vời để thử với bất kỳ món ăn nào. Hãy nhớ điều chỉnh lượng khi sử dụng các loại thảo mộc tươi. Các loại thảo mộc thông thường Húng quế- Các sản phẩm từ cà chua (nước trái cây, nước sốt mì ống, nước sốt pizza), trứng, thịt thú săn, thịt cừu, thịt bê, cơm, mì spaghetti, dầu giấm, súp (minestrone, đậu Hà Lan, khoai tây và rau), đậu, cà tím Húng tây- Trứng, thịt thú rừng, thịt cừu, thịt bê, cơm, thịt gia cầm, nước sốt thịt nướng, cá, hàu, súp, súp (hành tây, cà chua và rau), nấm, cà chua Hương thảo - Bánh bao, trứng, thịt thú săn, thịt cừu, thịt bê, thịt gia cầm, cá, sốt thịt nướng, thịt gà, thịt bò, súp (đậu và rau), đậu, nấm, khoai tây, súp lơ, củ cải Oregano- Các món cà chua, thịt bò, thịt thú săn, thịt bê, mì spaghetti, nghêu, súp (đậu, minestrone và cà chua), đậu, cà tím và nấm Thì là- Các món cà chua, bánh mì men, trứng, xà lách trộn, salad khoai tây, cá, đậu, cải Brussels, súp lơ, dưa chuột, bí mùa hè Mùi tây- Salad, rau, mì ống Cây xô thơm- Phô mai, thịt thú săn, thịt lợn, gạo, thịt gia cầm, súp (gà, minestrone và rau), nhân nhồi Rau mùi- Nấu ăn kiểu Mexico và châu Á, cơm, salsa, cà chua Bạc hà- Món tráng miệng, thịt cừu, đậu Hà Lan, salad trái cây, nước sốt",https://books.google.com/books/content?id=NaNh0AEACAAJ&printsec=frontcover&img=1&zoom=1&source=gbs_api,1835835805
165,n¿u ¿n cajun cay,"C¿¿ng Khánh, Cương Khánh",7,"Ẩm thực Cajun được biết đến với hương vị đậm đà và cay, chịu ảnh hưởng của các nền văn hóa đa dạng đã định hình nên truyền thống ẩm thực của Louisiana. Từ gumbo hải sản đến jambalaya, crawfish etouffee đến cá da trơn đen, ẩm thực Cajun có một cái gì đó cho tất cả mọi người. Trong cuốn sách dạy nấu ăn này, chúng tôi rất vui được chia sẻ 100 công thức nấu ăn Cajun ngon và chính thống, chắc chắn sẽ làm gia vị căn bếp của bạn. Cho dù bạn là một chuyên gia dày dạn kinh nghiệm hay một người mới làm quen với món ăn đầy hương vị này, chúng tôi sẽ hỗ trợ bạn. Công thức nấu ăn của chúng tôi rất dễ thực hiện, với hướng dẫn từng bước và mẹo hữu ích để đảm bảo rằng món ăn của bạn luôn luôn hoàn hảo. Chúng tôi cũng sẽ chia sẻ một số thông tin cơ bản về ẩm thực Cajun và lịch sử của nó, cũng như các mẹo để làm chủ hương vị và kỹ thuật độc đáo khiến món ăn này trở nên đặc biệt. Vì vậy, hãy tham gia cùng chúng tôi trên hành trình khám phá nghệ thuật nấu ăn Cajun. Với 100 công thức nấu ăn của chúng tôi, bạn sẽ có thể mang hương vị của Louisiana vào căn bếp của chính mình và gây ấn tượng với bạn bè và gia đình bằng kỹ năng nấu nướng của mình",https://books.google.com/books/content?id=QikV0AEACAAJ&printsec=frontcover&img=1&zoom=1&source=gbs_api,1835510337
166,SÁCH N¿U ¿N H¿I S¿N C¿N THI¿T CHO NG¿¿I M¿I B¿T ¿¿U,"C¿¿Ng Giáng, CƯƠng Giáng",7,"Có rất ít thứ trong cuộc sống có hương vị thơm ngon và thần thánh trên lưỡi bạn như một con tôm hùm, món tôm hoặc đĩa cá ngừ mới nấu chín hoặc được chế biến một cách chuyên nghiệp. Nếu bạn chưa từng biết đến hương vị cua hay hải sản tan chảy trong miệng thì cuốn sách này là dành cho bạn! Có rất nhiều cách ngon miệng để kết hợp hải sản vào bữa ăn của bạn. Đó là một cách lành mạnh và ngon miệng để ăn nạc, bổ sung protein và là nền tảng của chế độ ăn Địa Trung Hải. Các công thức nấu ăn dưới đây bao gồm cá hồi, tôm, sò điệp, bạch tuộc và cá tuyết chấm đen. Mỗi công thức đều tương đối dễ thực hiện và có đầy đủ hương vị lạ thường. Có một chút gì đó dành cho tất cả mọi người, từ cơm chiên tôm đến cá hồi sốt sốt lá húng cho đến sò điệp áp chảo hoàn hảo",https://books.google.com/books/content?id=3jJZ0AEACAAJ&printsec=frontcover&img=1&zoom=1&source=gbs_api,183583504X
167,C¿n giòn. Cu¿n sách n¿u ¿n cu¿i cùng c¿a Bánh mì n¿¿ng và Bruschetta,"Thành Tr¿ng, Thành Trọng",7,"Bạn đang tìm kiếm những món khai vị thơm ngon, dễ làm để gây ấn tượng với thực khách hay chỉ đơn giản là thưởng thức như một món ăn nhanh? Không cần tìm đâu xa hơn ""Cắn giòn"", cuốn sách dạy nấu ăn cuối cùng của Bánh mì nướng và Bruschetta! Trong cuốn sách dạy nấu ăn này, bạn sẽ tìm thấy hơn 100 công thức nấu ăn hấp dẫn cho mọi dịp, từ món bruschetta cà chua cổ điển đến món ăn kèm crostini sáng tạo như cá hồi hun khói và quả bơ hoặc pho mát dê và quả sung. Cho dù bạn đang tổ chức một bữa tiệc tối hay chỉ đơn giản là thèm một món ăn nhẹ ngon miệng, Bánh mì nướng và bruschetta là sự lựa chọn hoàn hảo. Với kết cấu giòn và sự kết hợp hương vị vô tận, chúng chắc chắn sẽ làm hài lòng khẩu vị của mọi người. Và với ""Cắn giòn"", bạn sẽ không bao giờ cạn ý tưởng cho món khai vị ngon miệng và ấn tượng. Trong cuốn sách nấu ăn này, bạn sẽ tìm thấy các công thức nấu món bruschetta truyền thống của Ý, cũng như những biến tấu sáng tạo trên món cổ điển, như món bruschetta rau củ nướng hoặc đào và prosciutto crostini. Bạn cũng sẽ khám phá ra những cách kết hợp hương vị mới, như dâu tây balsamic và ricotta, hoặc tỏi và nấm nướng. Vì vậy, cho dù bạn là một đầu bếp dày dạn kinh nghiệm hay người mới bắt đầu vào bếp, ""Cắn giòn"" đều có thứ gì đó dành cho tất cả mọi người. Với hướng dẫn dễ thực hiện và nguyên liệu đơn giản, bạn có thể chế biến những món khai vị ngon miệng này ngay lập tức. Hãy sẵn sàng để gây ấn tượng với khách của bạn và thỏa mãn cơn thèm của bạn với Sách dạy nấu ăn Bánh mì nướng và Bruschetta đỉnh cao!.",https://books.google.com/books/content?id=UBoZ0AEACAAJ&printsec=frontcover&img=1&zoom=1&source=gbs_api,1835515053
168,Sách D¿y N¿u ¿n Jack Daniels,Gloria Ibañez,7,"Chào mừng bạn đến với Sách dạy nấu ăn của Jack Daniels! Nếu bạn là người yêu thích các món ăn đậm đà và có hương vị, thì bạn sẽ được thưởng thức. Cuốn sách nấu ăn này chứa đầy 100 công thức nấu ăn ngon với hương vị không thể nhầm lẫn của rượu whisky Jack Daniels. Cho dù bạn là một đầu bếp gia đình dày dạn kinh nghiệm hay người mới bắt đầu vào bếp, cuốn sách nấu ăn này đều có thứ gì đó dành cho tất cả mọi người. Từ món khai vị đến món khai vị đến món tráng miệng, bạn sẽ tìm thấy nhiều lựa chọn hấp dẫn để lựa chọn. Và tất nhiên, mọi món ăn đều có chữ ký của Jack Daniels. Chúng tôi đã bao gồm các công thức nấu ăn cổ điển của miền Nam như thịt lợn kéo BBQ và gà rán, cũng như các món ăn độc đáo như cá hồi tráng men rượu whisky và cà rốt tráng men rượu whisky mật ong. Và đừng quên các món tráng miệng! Bạn sẽ thích bánh hồ đào ngâm rượu whisky và bánh whisky sô cô la của chúng tôi. Ban đầu, nấu ăn với rượu whisky có vẻ đáng sợ, nhưng đừng lo - chúng tôi sẽ hỗ trợ bạn. Trong cuốn sách dạy nấu ăn này, chúng tôi sẽ hướng dẫn bạn mọi thứ bạn cần biết về việc sử dụng Jack Daniels trong nấu ăn. Bạn sẽ học cách pha rượu whisky đúng cách vào các món ăn của mình và cách cân bằng hương vị để có hương vị hoàn hảo.",https://books.google.com/books/content?id=nDkY0AEACAAJ&printsec=frontcover&img=1&zoom=1&source=gbs_api,1835513123
169,Sách NẤu Ăn Bánh Tín CỦa Tôi,"¿ào Thanh, Đào Thanh",7,"Bước vào thế giới làm bánh ngọt ngào và ngon lành với ""Sách dạy nấu ăn bằng thiếc nhỏ của tôi: Từ những chiếc bánh nhỏ đến những chiếc bánh tart thơm ngon, Khám phá 100 món ăn hấp dẫn ngay từ lò nướng của bạn."" Làm bánh không chỉ là một nghệ thuật ẩm thực; đó là một cuộc hành trình kỳ diệu tràn ngập sự ấm áp, hương thơm và hứa hẹn về niềm đam mê thú vị. Trong cuốn sách nấu ăn này, chúng tôi mời bạn tham gia vào một cuộc phiêu lưu đầy hương vị khi chúng tôi khám phá một loạt thú vị gồm 100 món ăn không thể cưỡng lại, tất cả đều được nướng hoàn hảo trong hộp bánh đáng tin cậy của bạn. Từ những chiếc bánh nhỏ đơn giản được trang trí bằng những lớp kem phủ xoáy cho đến những chiếc bánh tart trang nhã chứa đầy trái cây theo mùa, mỗi công thức trong cuốn sách nấu ăn này đều được tạo ra để khơi dậy niềm đam mê làm bánh và thỏa mãn cơn thèm ngọt của bạn. Cho dù bạn là một thợ làm bánh dày dặn kinh nghiệm hay một người mới đam mê, bạn sẽ tìm thấy nguồn cảm hứng, sự hướng dẫn và niềm vui trong những trang này. Với hướng dẫn rõ ràng, mẹo hữu ích và hình ảnh tuyệt đẹp, bạn sẽ cảm thấy tự tin khi đánh, gấp và nướng theo cách riêng của mình để đạt được niềm vui ẩm thực. Hộp đựng bánh khiêm tốn đóng vai trò là bức vẽ cho những sáng tạo ẩm thực của chúng tôi, mang đến khả năng thử nghiệm và sáng tạo vô tận. Cho dù bạn đang nướng bánh cho một dịp đặc biệt, một buổi họp mặt ấm cúng hay chỉ đơn giản là để thưởng thức chiếc bánh ngọt ngào của mình, luôn có một món ăn phù hợp với mọi sở thích và mọi khoảnh khắc. Vì vậy, hãy làm nóng lò nướng trước, thu thập nguyên liệu và cùng hòa mình vào thế giới làm bánh đầy mê hoặc với ""Sách dạy nấu ăn bằng thiếc nhỏ của tôi"" làm hướng dẫn của chúng tôi.",https://books.google.com/books/content?id=apzQ0AEACAAJ&printsec=frontcover&img=1&zoom=1&source=gbs_api,1836236573
